{
  "anchors": [
    {
      "name": "earring_root",
      "position": [
        0.0,
        0.0,
        0.0
      ],
      "rotation": [
        0.0,
        0.0,
        0.0,
        1.0
      ]
    },
    {
      "name": "attachment_point",
      "position": [
        0.0,
        0.0,
        0.0
      ],
      "rotation": [
        0.0,
        0.0,
        0.0,
        1.0
      ]
    }
  ],
  "coordinateSystem": "right-handed-y-up",
  "schemaVersion": "1.0.0",
  "units": "meters"
}
