{
  "anchors": [
    {
      "name": "nose_pin_root",
      "position": [
        0.0,
        0.0,
        0.0
      ],
      "rotation": [
        0.0,
        0.0,
        0.0,
        1.0
      ]
    },
    {
      "name": "attachment_point",
      "position": [
        0.0,
        0.005198540166020393,
        0.0
      ],
      "rotation": [
        0.0,
        0.0,
        0.0,
        1.0
      ]
    },
    {
      "name": "gem_center",
      "position": [
        0.0,
        0.0,
        0.0005996340187266469
      ],
      "rotation": [
        0.0,
        0.0,
        0.0,
        1.0
      ]
    }
  ],
  "coordinateSystem": "right-handed-y-up",
  "schemaVersion": "1.0.0",
  "units": "meters"
}
