{
  "anchors": [
    {
      "name": "frame_root",
      "position": [
        4.190099120140076,
        -0.11849021911621094,
        1.7323304414749146
      ],
      "rotation": [
        0.0,
        0.0,
        0.0,
        1.0
      ]
    },
    {
      "name": "bridge_anchor",
      "position": [
        4.190099120140076,
        -0.11849021911621094,
        6.549127578735352
      ],
      "rotation": [
        0.0,
        0.0,
        0.0,
        1.0
      ]
    },
    {
      "name": "left_temple",
      "position": [
        -2.3867952823638916,
        -0.11849021911621094,
        1.7323304414749146
      ],
      "rotation": [
        0.0,
        0.0,
        0.0,
        1.0
      ]
    },
    {
      "name": "right_temple",
      "position": [
        10.766993522644043,
        -0.11849021911621094,
        1.7323304414749146
      ],
      "rotation": [
        0.0,
        0.0,
        0.0,
        1.0
      ]
    }
  ],
  "coordinateSystem": "right-handed-y-up",
  "schemaVersion": "1.0.0",
  "units": "meters"
}
