{
  "anchors": [
    {
      "name": "watch_root",
      "position": [
        0.15819072723388672,
        0.046384453773498535,
        -4.173255801200867
      ],
      "rotation": [
        0.0,
        0.0,
        0.0,
        1.0
      ]
    },
    {
      "name": "dial_center",
      "position": [
        0.15819072723388672,
        0.046384453773498535,
        -0.04921126365661621
      ],
      "rotation": [
        0.0,
        0.0,
        0.0,
        1.0
      ]
    },
    {
      "name": "strap_axis",
      "position": [
        0.15819072723388672,
        -3.7546186447143555,
        -4.173255801200867
      ],
      "rotation": [
        0.0,
        0.0,
        0.0,
        1.0
      ]
    }
  ],
  "coordinateSystem": "right-handed-y-up",
  "schemaVersion": "1.0.0",
  "units": "meters"
}
