{
  "anchors": [
    {
      "name": "ring_root",
      "position": [
        4.76837158203125e-07,
        -0.0003490447998046875,
        0.7613568305969238
      ],
      "rotation": [
        0.0,
        0.0,
        0.0,
        1.0
      ]
    },
    {
      "name": "ring_center",
      "position": [
        4.76837158203125e-07,
        -0.0003490447998046875,
        0.7613568305969238
      ],
      "rotation": [
        0.0,
        0.0,
        0.0,
        1.0
      ]
    },
    {
      "name": "band_axis",
      "position": [
        4.76837158203125e-07,
        -6.211189270019531,
        0.7613568305969238
      ],
      "rotation": [
        0.0,
        0.0,
        0.0,
        1.0
      ]
    }
  ],
  "coordinateSystem": "right-handed-y-up",
  "schemaVersion": "1.0.0",
  "units": "meters"
}
